1404,Design Patterns in JavaScript,Dmitri Nesteruk,4.6,670,10 total hours,103 lectures,Intermediate,"data:image/svg+xml,%3Csvg xmlns=""http://www.w3.org/2000/svg"" viewBox=""0 0 260 145""%3E%3C/svg%3E",https://www.udemy.com/course/design-patterns-javascript/,Discover the modern implementation of design patterns in JavaScript,₹385,"₹6,400",Development,Programming Languages,Design Pattern
1405,Spring Core Advanced - Beyond the Basics,John Thompson,4,669,6 total hours,63 lectures,Intermediate,"data:image/svg+xml,%3Csvg xmlns=""http://www.w3.org/2000/svg"" viewBox=""0 0 260 145""%3E%3C/svg%3E",https://www.udemy.com/course/spring-core-advanced-beyond-the-basics/,Enterprise class use of Spring Framework 4 and Spring Boot,₹385,"₹6,080",Development,Programming Languages,Aspect-Oriented Programming
1406,Adobe Experience Manager 6.3 | The Complete AEM Masterclass,Jasvinder Singh Bhatia,4.1,669,6 total hours,53 lectures,All Levels,"data:image/svg+xml,%3Csvg xmlns=""http://www.w3.org/2000/svg"" viewBox=""0 0 260 145""%3E%3C/svg%3E",https://www.udemy.com/course/adobe-experience-manager-63/,"Build We.Learn AEM Website. Learn Templates, Components, Dispatcher, HTL/Sightly, ClientLibs, Sling, OSGi, list goes on!",₹385,"₹2,560",Development,Web Development,Adobe Experience Manager
1407,Functional & Reactive programming in Java : Modern Style,Basics Strong,4.6,669,21 total hours,192 lectures,All Levels,"data:image/svg+xml,%3Csvg xmlns=""http://www.w3.org/2000/svg"" viewBox=""0 0 260 145""%3E%3C/svg%3E",https://www.udemy.com/course/functional-programming-and-reactive-programming-in-java/,"Java Programming MasterClass, Design Patterns,Data Structures,Lambda,Streams,Collectors,Collections,Optionals & RxJava",₹385,"₹1,280",Development,Programming Languages,Functional Programming
1408,Design Patterns in Swift,Dmitri Nesteruk,4.6,671,8.5 total hours,113 lectures,Intermediate,"data:image/svg+xml,%3Csvg xmlns=""http://www.w3.org/2000/svg"" viewBox=""0 0 260 145""%3E%3C/svg%3E",https://www.udemy.com/course/design-patterns-swift/,Discover the modern implementation of design patterns with Swift,₹385,"₹6,400",Development,Programming Languages,Design Pattern
1409,Nodejs Express - unit testing/integration tests with Jest,Stefan Hyltoft,4.3,667,3 total hours,62 lectures,Beginner,"data:image/svg+xml,%3Csvg xmlns=""http://www.w3.org/2000/svg"" viewBox=""0 0 260 145""%3E%3C/svg%3E",https://www.udemy.com/course/nodejs-unit-testing-and-integration-testing-with-express-and-jest/,"Learn to build a full CRUD REST API with Nodejs using TDD in Jest in JavaScript, with unit testing and integration test",₹385,"₹8,640",Development,Web Development,Node.Js
1410,Mastering Wireshark 2,Packt Publishing,4.7,665,5.5 total hours,46 lectures,Intermediate,"data:image/svg+xml,%3Csvg xmlns=""http://www.w3.org/2000/svg"" viewBox=""0 0 260 145""%3E%3C/svg%3E",https://www.udemy.com/course/mastering-wireshark-2/,Secure your network with ease by leveraging this step-by-step tutorial on the powerful Wireshark 2,₹385,"₹8,000",Development,Software Development Tools,Wireshark
1411,Bootstrap 5 Course: The Complete Guide (Step by Step),Fatah Gabrial,4.3,665,5.5 total hours,67 lectures,All Levels,"data:image/svg+xml,%3Csvg xmlns=""http://www.w3.org/2000/svg"" viewBox=""0 0 260 145""%3E%3C/svg%3E",https://www.udemy.com/course/the-complete-bootstrap-5-course-for-beginners-step-by-step/,Build 3 Live Real-World Projects with the Latest Bootstrap 5 CSS Framework. In-Depth Training on Bootstrap 5,₹385,"₹4,800",Development,Web Development,Bootstrap
1412,Text Mining and Natural Language Processing in R,Minerva Singh,4.4,665,8.5 total hours,81 lectures,All Levels,"data:image/svg+xml,%3Csvg xmlns=""http://www.w3.org/2000/svg"" viewBox=""0 0 260 145""%3E%3C/svg%3E",https://www.udemy.com/course/text-mining-and-natural-language-processing-in-r/,Hands-on text mining and natural language processing (NLP) training for data science applications in R,₹385,"₹8,640",Development,Data Science,Text Mining
1413,Comprehensive ASP.net MVC,3D BUZZ Programming and Digital Art training,4.5,663,14 total hours,34 lectures,All Levels,"data:image/svg+xml,%3Csvg xmlns=""http://www.w3.org/2000/svg"" viewBox=""0 0 260 145""%3E%3C/svg%3E",https://www.udemy.com/course/comprehensive-aspnet-mvc/,From zero knowledge of ASP.NET to deploying a complete project to production.,₹385,"₹1,920",Development,Programming Languages,ASP.NET MVC
1414,Salesforce Visualforce Development: Create Visualforce pages,Deepika Khanna,4.5,663,6.5 total hours,59 lectures,All Levels,"data:image/svg+xml,%3Csvg xmlns=""http://www.w3.org/2000/svg"" viewBox=""0 0 260 145""%3E%3C/svg%3E",https://www.udemy.com/course/learn-salesforce-visualforce-step-by-step/,"Salesforce Visualforce: create custom pages, learn about tags, standard controller, custom controller and extensions",₹385,"₹8,640",Development,Web Development,Salesforce VisualForce
1415,"UI&UX Design , Animation And Material design In Javafx",Mohamed Adel,3.2,661,7 total hours,47 lectures,All Levels,"data:image/svg+xml,%3Csvg xmlns=""http://www.w3.org/2000/svg"" viewBox=""0 0 260 145""%3E%3C/svg%3E",https://www.udemy.com/course/ui-ux-design-animation-and-material-design-in-javafx/,Create your Professional javafx application with with a pretty user interfaces and material design,₹385,"₹8,640",Development,Programming Languages,User Experience Design
1416,Learn Flutter and Dart to create Android and IOS apps,Code Warriors,4,661,10 total hours,30 lectures,Beginner,"data:image/svg+xml,%3Csvg xmlns=""http://www.w3.org/2000/svg"" viewBox=""0 0 260 145""%3E%3C/svg%3E",https://www.udemy.com/course/learn-flutter-in-30-days/,Learn to create Awesome Mobile Apps using Flutter and Dart,₹556,"₹1,920",Development,Mobile Development,Google Flutter
1417,HTML5 Specialist: Comprehensive HTML5 Training,Framework Tech Media,4.7,660,5 total hours,83 lectures,All Levels,"data:image/svg+xml,%3Csvg xmlns=""http://www.w3.org/2000/svg"" viewBox=""0 0 260 145""%3E%3C/svg%3E",https://www.udemy.com/course/html5-specialist/,Earn a professional credential while learning HTML5.,₹385,"₹6,400",Development,Web Development,HTML5
1418,"Learn AWS Identity Management with AWS IAM, SSO & Federation","Neal Davis | AWS Certified Solutions Architect & Developer, Digital Cloud Training | AWS Certified Cloud Practitioner AWS Certified Solutions Architect, AWS Developer Associate",4.7,660,4 total hours,50 lectures,Beginner,"data:image/svg+xml,%3Csvg xmlns=""http://www.w3.org/2000/svg"" viewBox=""0 0 260 145""%3E%3C/svg%3E",https://www.udemy.com/course/aws-iam-aws-organizations-aws-sso-aws-directory-service-federation/,"Deep dive into Amazon AWS Identity Access Management (AWS IAM) + AWS Organizations, Directory Service, Federation & SSO",₹385,"₹1,920",Development,Software Engineering,Identity Access Management
1419,Using MySQL Databases With Python,John Elder,4.4,660,2 total hours,25 lectures,Beginner,"data:image/svg+xml,%3Csvg xmlns=""http://www.w3.org/2000/svg"" viewBox=""0 0 260 145""%3E%3C/svg%3E",https://www.udemy.com/course/using-mysql-databases-with-python/,Learn MySql Database With Python The Fast and Easy Way!,₹385,"₹8,640",Development,Database Design & Development,MySQL
1420,Project Based Python Programming For Kids & Beginners,Minerva Singh,4.4,660,5 total hours,56 lectures,All Levels,"data:image/svg+xml,%3Csvg xmlns=""http://www.w3.org/2000/svg"" viewBox=""0 0 260 145""%3E%3C/svg%3E",https://www.udemy.com/course/project-based-python-programming-for-kids-beginners/,"Learn Hands-On Python Programming By Creating Games, GUIs and Graphics",₹385,"₹8,640",Development,Programming Languages,Python
1421,Agile Scrum Advanced Software Development+Program Management,Paul Ashun,4.3,659,1 total hour,36 lectures,All Levels,"data:image/svg+xml,%3Csvg xmlns=""http://www.w3.org/2000/svg"" viewBox=""0 0 260 145""%3E%3C/svg%3E",https://www.udemy.com/course/nexus-scrum-advanced/,"Learn the Scrum of Scrums technique,  how to Become a Scrum Master and how to Coach by explaining scrum with 72 reasons",₹385,"₹8,640",Development,Programming Languages,Scrum
1422,Java Spring Security,Trevor Page,4.1,659,3 total hours,15 lectures,Intermediate,"data:image/svg+xml,%3Csvg xmlns=""http://www.w3.org/2000/svg"" viewBox=""0 0 260 145""%3E%3C/svg%3E",https://www.udemy.com/course/how-to-use-spring-security-to-secure-your-java-applications/,Java Spring Security allows you to add a layer of security to your Java web applications.,₹385,"₹1,280",Development,Web Development,Java
1423,How to Create iOS 2D Games with SpriteKit and Swift,Brian Advent,4.9,658,4 total hours,41 lectures,Intermediate,"data:image/svg+xml,%3Csvg xmlns=""http://www.w3.org/2000/svg"" viewBox=""0 0 260 145""%3E%3C/svg%3E",https://www.udemy.com/course/2d-games-with-spritekit/,SpriteKit: Learn to Build 2D Games by Creating a Real World Arcade Game from the iOS App Store.,₹385,"₹8,640",Development,Game Development,iOS Game Development
1424,JavaScript Complete Beginners Course For Web Development,Funky Programmer,4.2,657,12.5 total hours,98 lectures,Beginner,"data:image/svg+xml,%3Csvg xmlns=""http://www.w3.org/2000/svg"" viewBox=""0 0 260 145""%3E%3C/svg%3E",https://www.udemy.com/course/javascript-beginnerscourse/,"JavaScript tutorial for Beginner, JavaScript Loop ,JS function,  JavaScript ES6, JavaScript DOM, Modern JavaScript",₹385,"₹6,400",Development,Web Development,JavaScript
1425,JSON in Action: Build JSON-Based Applications,Crypters Infotech,4.7,657,4.5 total hours,40 lectures,All Levels,"data:image/svg+xml,%3Csvg xmlns=""http://www.w3.org/2000/svg"" viewBox=""0 0 260 145""%3E%3C/svg%3E",https://www.udemy.com/course/json-in-action/,Learn JSON from Scratch! Learn JavaScript Object Notation (JSON) to Build API-Based Apps! Develop 2 JSON-Based Projects,₹385,"₹6,400",Development,Web Development,JSON
1426,High Performance Coding with .NET Core and C#,Gergely Kalapos,4.5,657,6.5 total hours,38 lectures,Intermediate,"data:image/svg+xml,%3Csvg xmlns=""http://www.w3.org/2000/svg"" viewBox=""0 0 260 145""%3E%3C/svg%3E",https://www.udemy.com/course/high-performance-coding-with-net-core-and-csharp/,Learn how to write high performance and scalable .NET Core and ASP.NET Core applications in C#,₹385,"₹7,680",Development,Software Engineering,.NET
1427,Laravel with Vue.js - Fullstack Web Development (2020),Eding Muhamad Saprudin,4.7,657,30.5 total hours,227 lectures,All Levels,"data:image/svg+xml,%3Csvg xmlns=""http://www.w3.org/2000/svg"" viewBox=""0 0 260 145""%3E%3C/svg%3E",https://www.udemy.com/course/laravel-vuejs-fullstack-web-development/,Learn how to combine Laravel PHP Framework & Vue.js to build powerful API and Single Page Application (SPA) from scratch,₹385,"₹6,400",Development,Web Development,Laravel
1428,Universal React with Next.js - The Ultimate Guide,Reed Barger,4.6,655,9.5 total hours,90 lectures,All Levels,"data:image/svg+xml,%3Csvg xmlns=""http://www.w3.org/2000/svg"" viewBox=""0 0 260 145""%3E%3C/svg%3E",https://www.udemy.com/course/universal-react-with-nextjs-the-ultimate-guide/,Learn how to make awesome server-rendered React apps with Next.js,₹385,"₹1,920",Development,Web Development,React
1429,Android Development Working With Databases Using Mysql & PHP,"Joe Parys, Ashutosh Pawar, Joe Parys Support",4.3,655,3.5 total hours,20 lectures,Expert,"data:image/svg+xml,%3Csvg xmlns=""http://www.w3.org/2000/svg"" viewBox=""0 0 260 145""%3E%3C/svg%3E",https://www.udemy.com/course/android-development-course/,In this complete course students will learn android development by working with databases using Mysql and PHP,₹385,"₹8,640",Development,Mobile Development,Android Development
1430,What's New in Java 9 - Modules and More!,"Tim Buchalka's Learn Programming Academy, Dr. Frank Mitropoulos",4.7,655,7.5 total hours,63 lectures,Intermediate,"data:image/svg+xml,%3Csvg xmlns=""http://www.w3.org/2000/svg"" viewBox=""0 0 260 145""%3E%3C/svg%3E",https://www.udemy.com/course/whats-new-in-java-9/,"Improve Your Career Prospects by Learning About New Java 9 Features Like Modules, JShell, Processes and More.",₹556,"₹3,200",Development,Programming Languages,Java
1431,Python on the Backend,Hussein Nasser,4.3,654,4 total hours,29 lectures,All Levels,"data:image/svg+xml,%3Csvg xmlns=""http://www.w3.org/2000/svg"" viewBox=""0 0 260 145""%3E%3C/svg%3E",https://www.udemy.com/course/python-on-the-back-end-for-beginners-http-server/,"Learn python back end development, build a website or APIs in Python, designed for students with Mac or Windows",₹385,"₹5,120",Development,Programming Languages,HTTP
1432,"Modern Android app using Kotlin, MVVM, Dagger2, RxJava &more",Catalin Stefan,4.4,651,3 total hours,29 lectures,All Levels,"data:image/svg+xml,%3Csvg xmlns=""http://www.w3.org/2000/svg"" viewBox=""0 0 260 145""%3E%3C/svg%3E",https://www.udemy.com/course/modernandroid/,"Learn the latest Android technologies including Dagger2, MVVM, Kotlin, RxJava, Retrofit, Mockito and Glide",₹385,"₹8,640",Development,Mobile Development,Android Development
1433,Swift 3 - Learn to Code with Apple's New Language,Nick Walter,4.1,651,4 total hours,100 lectures,Beginner,"data:image/svg+xml,%3Csvg xmlns=""http://www.w3.org/2000/svg"" viewBox=""0 0 260 145""%3E%3C/svg%3E",https://www.udemy.com/course/swift-3-learn-to-code-with-apples-new-language/,Learn to Program Swift 3 with Xcode Playgrounds. Be a part of the world's fastest growing programming language! iOS 10,₹385,"₹8,640",Development,Programming Languages,Swift
1434,Objective-C Crash Course for Swift Developers,"Mark Wahlbeck, Devslopes by Mark Wahlbeck",4.5,649,8.5 total hours,53 lectures,Intermediate,"data:image/svg+xml,%3Csvg xmlns=""http://www.w3.org/2000/svg"" viewBox=""0 0 260 145""%3E%3C/svg%3E",https://www.udemy.com/course/objectivec/,Everything you need to know about modern Objective-C to use it professionally,₹385,"₹1,600",Development,Mobile Development,Objective-C
1435,Artificial Neural Networks (ANN) with Keras in Python and R,Start-Tech Academy,4,648,11 total hours,77 lectures,All Levels,"data:image/svg+xml,%3Csvg xmlns=""http://www.w3.org/2000/svg"" viewBox=""0 0 260 145""%3E%3C/svg%3E",https://www.udemy.com/course/deep-learning-with-keras-and-tensorflow-in-python-and-r/,Understand Deep Learning and build Neural Networks using TensorFlow 2.0 and Keras in Python and R,₹385,"₹1,280",Development,Data Science,Keras
1436,Code with Node JS - 2021,Ian Schoonover,4.4,647,19 total hours,183 lectures,Intermediate,"data:image/svg+xml,%3Csvg xmlns=""http://www.w3.org/2000/svg"" viewBox=""0 0 260 145""%3E%3C/svg%3E",https://www.udemy.com/course/code-with-node/,"Build a Feature Rich, Production Ready, Web Application with Node JS",₹396,"₹8,640",Development,Web Development,Express Framework
1437,JavaScript Course: Complete Guide (Step by Step),Fatah Gabrial,4.1,647,2 total hours,35 lectures,All Levels,"data:image/svg+xml,%3Csvg xmlns=""http://www.w3.org/2000/svg"" viewBox=""0 0 260 145""%3E%3C/svg%3E",https://www.udemy.com/course/complete-javascript-for-beginners/,Learn in-depth Complete JavaScript from Scratch step by step,₹385,"₹4,800",Development,Web Development,JavaScript
1438,Deno: The Complete Guide Zero to Mastery,"Andrei Neagoie, Adam Odziemkowski",4.7,648,13.5 total hours,172 lectures,All Levels,"data:image/svg+xml,%3Csvg xmlns=""http://www.w3.org/2000/svg"" viewBox=""0 0 260 145""%3E%3C/svg%3E",https://www.udemy.com/course/deno-the-complete-guide-zero-to-mastery/,Master Deno and learn to build professional scale Deno apps! The must learn technology of 2021 for JavaScript developers,₹385,"₹8,640",Development,Programming Languages,Deno
1439,Web Security and Hacking for Beginners,One Month,4.4,646,5 total hours,75 lectures,Intermediate,"data:image/svg+xml,%3Csvg xmlns=""http://www.w3.org/2000/svg"" viewBox=""0 0 260 145""%3E%3C/svg%3E",https://www.udemy.com/course/one-month-web-security/,One Month Web Security,₹522,"₹1,920",Development,Software Testing,Web Security
1440,Learn and Build using Polymer LitElement (beyond Polymer 3),Arman Eker,3.7,646,9 total hours,116 lectures,All Levels,"data:image/svg+xml,%3Csvg xmlns=""http://www.w3.org/2000/svg"" viewBox=""0 0 260 145""%3E%3C/svg%3E",https://www.udemy.com/course/learn-and-build-using-polymer/,Learn how to create Custom Elements and Web Applications with Polymer LitElement. LitElement is successor to Polymer 3,₹385,"₹8,640",Development,Web Development,Polymer
1441,Introduction to Java EE,Ocho Tech,4.2,646,1.5 total hours,20 lectures,Beginner,"data:image/svg+xml,%3Csvg xmlns=""http://www.w3.org/2000/svg"" viewBox=""0 0 260 145""%3E%3C/svg%3E",https://www.udemy.com/course/java-ee-fundamentals/,Learn the Fundamentals of Java EE and Learn How to Package & Deploy an App,₹385,"₹1,600",Development,Programming Languages,Java EE
1442,Android App Development using Kotlin,Smartherd Developers,4.1,646,3.5 total hours,27 lectures,Beginner,"data:image/svg+xml,%3Csvg xmlns=""http://www.w3.org/2000/svg"" viewBox=""0 0 260 145""%3E%3C/svg%3E",https://www.udemy.com/course/android-app-development-using-kotlin/,Develop Android apps in Kotlin and publish it to Play Store,₹385,"₹8,640",Development,Mobile Development,Android Development
1443,Learn Unit Testing with NUnit and C#,Engineer Spock,4.4,647,7.5 total hours,94 lectures,Beginner,"data:image/svg+xml,%3Csvg xmlns=""http://www.w3.org/2000/svg"" viewBox=""0 0 260 145""%3E%3C/svg%3E",https://www.udemy.com/course/unit-testing/,"Learn unit testing, TDD, mocking and Dependency Injection: techniques that you'll need to build reliable software.",₹385,"₹2,560",Development,Software Engineering,C#
1444,Swift 5 Programming For Beginners,Nick Walter,4.4,644,6 total hours,40 lectures,All Levels,"data:image/svg+xml,%3Csvg xmlns=""http://www.w3.org/2000/svg"" viewBox=""0 0 260 145""%3E%3C/svg%3E",https://www.udemy.com/course/swift-programming/,Learn to Code Swift 5 with Mac's Xcode Playgrounds or Linux or Windows. make iOS 12 iPhone Apps or Command Line Tools,₹396,"₹8,640",Development,Programming Languages,Swift
1445,Learn C# Programming (In Ten Easy Steps),Huw Collingbourne,4.6,644,7.5 total hours,126 lectures,Beginner,"data:image/svg+xml,%3Csvg xmlns=""http://www.w3.org/2000/svg"" viewBox=""0 0 260 145""%3E%3C/svg%3E",https://www.udemy.com/course/learn-c-sharp-programming-in-ten-easy-steps/,The simplest way to learn C# programming.,₹407,"₹8,960",Development,Programming Languages,C#
1446,Learn Bootstrap 4 Responsive Web Development,Frahaan Hussain,4.8,644,4.5 total hours,64 lectures,Beginner,"data:image/svg+xml,%3Csvg xmlns=""http://www.w3.org/2000/svg"" viewBox=""0 0 260 145""%3E%3C/svg%3E",https://www.udemy.com/course/bootstrap-web/,Learn how to create responsive websites using Bootstrap,₹385,"₹3,200",Development,Web Development,Responsive Design
1447,Microsoft Access SQL: SQL for Non-Programmers,IsáBel .,4.3,643,4 total hours,87 lectures,Beginner,"data:image/svg+xml,%3Csvg xmlns=""http://www.w3.org/2000/svg"" viewBox=""0 0 260 145""%3E%3C/svg%3E",https://www.udemy.com/course/learn-access-sql-from-scratch/,"Learn How You Can Use SQL in Microsoft Access with the Tips, Tools, and Exercises in This Best-Selling Course.",₹385,"₹8,640",Development,Database Design & Development,Microsoft Access
1448,Git and GitHub For Beginners,Yaswanth Sai Palaghat,4,642,1 total hour,10 lectures,All Levels,"data:image/svg+xml,%3Csvg xmlns=""http://www.w3.org/2000/svg"" viewBox=""0 0 260 145""%3E%3C/svg%3E",https://www.udemy.com/course/gitandgithubforbeginners/,Learn Git and Github From Scratch,₹385,"₹3,200",Development,Software Development Tools,Git
1449,Learn Python Programming From Scratch,"Eduonix Learning Solutions, Eduonix-Tech ., Eduonix Support",4.6,642,6.5 total hours,40 lectures,Beginner,"data:image/svg+xml,%3Csvg xmlns=""http://www.w3.org/2000/svg"" viewBox=""0 0 260 145""%3E%3C/svg%3E",https://www.udemy.com/course/learn-python-programming-from-scratch/,A Great Resource to Start and Master Python Development,₹385,"₹1,920",Development,Programming Languages,Python
1450,Build Multiplayer Games With Unity And Photon ( PUN 2),"Tevfik Ufuk DEMİRBAŞ, IRONHEAD Games",4.7,641,11 total hours,87 lectures,Intermediate,"data:image/svg+xml,%3Csvg xmlns=""http://www.w3.org/2000/svg"" viewBox=""0 0 260 145""%3E%3C/svg%3E",https://www.udemy.com/course/build-multiplayer-games-with-unity-and-photon-pun-2/,Multiplayer game development made easy.Learn the basics of Multiplayer games by building from the scratch with Photon.,₹396,"₹8,640",Development,Game Development,Game Development Fundamentals
1451,Guide to Front-End Web Development and Design,Laurence Svekis,4.6,641,17.5 total hours,211 lectures,Beginner,"data:image/svg+xml,%3Csvg xmlns=""http://www.w3.org/2000/svg"" viewBox=""0 0 260 145""%3E%3C/svg%3E",https://www.udemy.com/course/complete-guide-to-front-end-web-development-and-design/,Complete guide to learning how to program online HTML CSS HTML5 CSS3 JavaScript jQuery,₹385,"₹8,640",Development,Web Development,Front End Web Development
1452,Data Visualization in Python Masterclass™: Beginners to Pro,Laxmi Kant,4.4,640,22 total hours,225 lectures,All Levels,"data:image/svg+xml,%3Csvg xmlns=""http://www.w3.org/2000/svg"" viewBox=""0 0 260 145""%3E%3C/svg%3E",https://www.udemy.com/course/complete-data-visualization-in-python/,"Visualisation in matplotlib, Seaborn, Plotly & Cufflinks,  EDA on Boston Housing, Titanic, IPL, FIFA, Covid-19 Data.",₹385,"₹1,280",Development,Data Science,Data Visualization
1453,Artificial Intelligence I: Meta-Heuristics and Games in Java,Holczer Balazs,4.7,640,9 total hours,79 lectures,All Levels,"data:image/svg+xml,%3Csvg xmlns=""http://www.w3.org/2000/svg"" viewBox=""0 0 260 145""%3E%3C/svg%3E",https://www.udemy.com/course/artificial-intelligence-games-in-java/,"Graph Algorithms, Genetic Algorithms, Simulated Annealing, Swarm Intelligence, Minimax, Heuristics and Meta-Heuristics",₹385,"₹8,640",Development,Data Science,Java
1454,Docker Container Fundamentals (Hands-on) - DevOps,Ganesh Velrajan,3.7,640,2 total hours,17 lectures,All Levels,"data:image/svg+xml,%3Csvg xmlns=""http://www.w3.org/2000/svg"" viewBox=""0 0 260 145""%3E%3C/svg%3E",https://www.udemy.com/course/docker-containers-for-beginners-ganesh-velrajan/,Learn the fundamentals of Docker Container for beginners in devops in this docker tutorial,₹385,"₹1,280",Development,Software Development Tools,Docker Containers
1455,Complete Angular 11 from Zero to Hero | Get Hired,M Darwish,4,639,30.5 total hours,167 lectures,All Levels,"data:image/svg+xml,%3Csvg xmlns=""http://www.w3.org/2000/svg"" viewBox=""0 0 260 145""%3E%3C/svg%3E",https://www.udemy.com/course/angular-course-from-scratch-get-hired/,"All Angular 11 (Angular 2+, 4, 6, 7, 8, 9, 10 ) topics with Fire-base, Typescript 4, Bootstrap 4 [4 Projects]",₹385,"₹1,280",Development,Web Development,Angular
1456,Golang - JumpStart,Abhijan Guha,3.5,639,2.5 total hours,36 lectures,Beginner,"data:image/svg+xml,%3Csvg xmlns=""http://www.w3.org/2000/svg"" viewBox=""0 0 260 145""%3E%3C/svg%3E",https://www.udemy.com/course/goprogramming/,Get Familiar With Google Go Programming Language Fundamentals.,₹385,"₹1,280",Development,Programming Languages,Go (programming language)
1457,CSS Bootcamp - Master CSS (CSS Grid / CSS Flexbox),"Code And Create, George Lomidze, Lasha Nozadze",4.6,639,11.5 total hours,89 lectures,All Levels,"data:image/svg+xml,%3Csvg xmlns=""http://www.w3.org/2000/svg"" viewBox=""0 0 260 145""%3E%3C/svg%3E",https://www.udemy.com/course/css-bootcamp-master-in-css-including-css-grid-flexbox/,"CSS Course - Project Based CSS Tutorial. Learn how to create modern, responsive websites using CSS / CSS Grid / Flexbox",₹385,"₹1,280",Development,Web Development,CSS
1458,Fundamentals of Watson Analytics,VICONIC Development,4.5,638,1 total hour,21 lectures,All Levels,"data:image/svg+xml,%3Csvg xmlns=""http://www.w3.org/2000/svg"" viewBox=""0 0 260 145""%3E%3C/svg%3E",https://www.udemy.com/course/fundamentals-of-watson-analytics/,Learn the Fundamentals of Watson Analytics,₹385,"₹1,280",Development,Software Development Tools,Data Analysis
1459,A Gentle Introduction To ASP.NET Web Forms For Beginners,Charlie Chiarelli,4.4,637,24.5 total hours,132 lectures,Beginner,"data:image/svg+xml,%3Csvg xmlns=""http://www.w3.org/2000/svg"" viewBox=""0 0 260 145""%3E%3C/svg%3E",https://www.udemy.com/course/a-gentle-introduction-to-aspnet-web-forms-for-beginners/,"A First Step to Creating Dynamic Websites Using Web Forms , MVC , Razor Pages and  Blazor",₹385,"₹1,600",Development,Web Development,ASP.NET
1460,Complete Data Analysis with Pandas : Hands-on Pandas Python,"Ankit Mistry, Data Science & Machine Learning Academy",4.7,636,17 total hours,150 lectures,All Levels,"data:image/svg+xml,%3Csvg xmlns=""http://www.w3.org/2000/svg"" viewBox=""0 0 260 145""%3E%3C/svg%3E",https://www.udemy.com/course/data-analysis-with-pandas-python/,"Learn in demand skill Pandas, Sci-kit Learn, Numpy For Data Science & Machine Learning : Seaborn | MatplotLib  | Python",₹385,"₹8,640",Development,Data Science,Pandas
1461,Learn JavaScript for beginners,Laurence Svekis,4.6,636,1.5 total hours,21 lectures,Beginner,"data:image/svg+xml,%3Csvg xmlns=""http://www.w3.org/2000/svg"" viewBox=""0 0 260 145""%3E%3C/svg%3E",https://www.udemy.com/course/learn-javascript-course/,Explore the fundamental concepts of JavaScript and how to being adding JavaScript to your web pages,₹385,"₹8,640",Development,Web Development,JavaScript
