896,Make a Responsive Portfolio Website: JavaScript and HTML,Reece Kenney,4.8,"1,243",4 total hours,52 lectures,Beginner,https://img-c.udemycdn.com/course/240x135/1623806_1294_2.jpg,https://www.udemy.com/course/portfolio-website/,Use JavaScript and HTML to create the ultimate responsive portfolio website from scratch!,₹385,"₹3,200",Development,Web Development,HTML
897,Domain Driven Design: Complete Software Architecture Course,Binary Brain,4.2,"1,243",1.5 total hours,14 lectures,All Levels,"data:image/svg+xml,%3Csvg xmlns=""http://www.w3.org/2000/svg"" viewBox=""0 0 260 145""%3E%3C/svg%3E",https://www.udemy.com/course/domain-driven-design-complete-software-architecture-course/,"Learn Domain Driven Design (DDD) by example with detailed coding sessions, video explanations and realistic assignments.",₹385,"₹6,400",Development,Software Engineering,Software Architecture
898,Applied Statistical Modeling for Data Analysis in R,Minerva Singh,4.3,"1,243",9.5 total hours,70 lectures,All Levels,"data:image/svg+xml,%3Csvg xmlns=""http://www.w3.org/2000/svg"" viewBox=""0 0 260 145""%3E%3C/svg%3E",https://www.udemy.com/course/applied-statistical-modeling-for-data-analysis-in-r/,Your Complete Guide to Statistical Data Analysis and Visualization For Practical Applications in R,₹385,"₹8,640",Development,Data Science,R (programming language)
899,.NET 5 & .NET Core 3.1 Web API & Entity Framework Jumpstart,Patrick God,4.5,"1,234",11 total hours,147 lectures,All Levels,"data:image/svg+xml,%3Csvg xmlns=""http://www.w3.org/2000/svg"" viewBox=""0 0 260 145""%3E%3C/svg%3E",https://www.udemy.com/course/net-core-31-web-api-entity-framework-core-jumpstart/,"Build the back-end of a .NET 5 or .NET Core. 3.1 web application with Web API, Entity Framework & SQL Server in no time!",₹385,"₹6,400",Development,Web Development,ASP.NET Core
900,TensorFlow Developer Certificate in 2021: Zero to Mastery,"Andrei Neagoie, Daniel Bourke",4.7,"1,232",63.5 total hours,417 lectures,All Levels,"data:image/svg+xml,%3Csvg xmlns=""http://www.w3.org/2000/svg"" viewBox=""0 0 260 145""%3E%3C/svg%3E",https://www.udemy.com/course/tensorflow-developer-certificate-machine-learning-zero-to-mastery/,"Pass the TensorFlow Developer Certification Exam by Google. Become an AI, Machine Learning, and Deep Learning expert!",₹385,"₹8,640",Development,Data Science,TensorFlow
901,Python Programming for Beginners,Stone River eLearning,4.5,"1,231",3 total hours,26 lectures,Beginner,"data:image/svg+xml,%3Csvg xmlns=""http://www.w3.org/2000/svg"" viewBox=""0 0 260 145""%3E%3C/svg%3E",https://www.udemy.com/course/python-and-python-django-for-beginners-2-course-package/,"Recently updated with new, better Python development content for beginners.",₹385,"₹6,080",Development,Programming Languages,Python
902,OpenAPI: Beginner to Guru,John Thompson,4.6,"1,230",5 total hours,52 lectures,All Levels,"data:image/svg+xml,%3Csvg xmlns=""http://www.w3.org/2000/svg"" viewBox=""0 0 260 145""%3E%3C/svg%3E",https://www.udemy.com/course/openapi-beginner-to-guru/,Master OpenAPI (formerly Swagger) to Create Specifications for Your APIs,₹385,"₹8,640",Development,Software Development Tools,Open API Specification
903,Ultimate Rust Crash Course,Nathan Stocks,4.7,"1,229",3 total hours,35 lectures,All Levels,"data:image/svg+xml,%3Csvg xmlns=""http://www.w3.org/2000/svg"" viewBox=""0 0 260 145""%3E%3C/svg%3E",https://www.udemy.com/course/ultimate-rust-crash-course/,Rust Programming Fundamentals,₹385,"₹3,200",Development,Programming Languages,Rust (programming language)
904,The Complete JIRA Agile Project Management Course,Danny Liu,4.4,"1,226",2 total hours,48 lectures,Beginner,"data:image/svg+xml,%3Csvg xmlns=""http://www.w3.org/2000/svg"" viewBox=""0 0 260 145""%3E%3C/svg%3E",https://www.udemy.com/course/the-complete-jira-agile-project-management-course/,Learn how to quickly manage Scrum and Kanban Agile projects using JIRA Software Cloud and more!,₹385,"₹6,080",Development,Software Development Tools,JIRA
905,Wanna Learn JMeter ?Get Training by Industry Experts-18+hrs,T World,4.5,"1,223",19.5 total hours,165 lectures,All Levels,"data:image/svg+xml,%3Csvg xmlns=""http://www.w3.org/2000/svg"" viewBox=""0 0 260 145""%3E%3C/svg%3E",https://www.udemy.com/course/basic-to-expert-jmeter/,"JMeter4, JMeter 5 Coverage, performance testing/ Load Testing, Beanshell scripting, Jmeter API testing",₹385,"₹8,640",Development,Software Testing,JMeter
906,Git for Geeks: Quick Git Training for Developers,Jason Taylor,4.3,"1,220",3.5 total hours,74 lectures,Intermediate,"data:image/svg+xml,%3Csvg xmlns=""http://www.w3.org/2000/svg"" viewBox=""0 0 260 145""%3E%3C/svg%3E",https://www.udemy.com/course/git-for-geeks/,Learn the core features of Git in less time for experienced software engineers new to Git,₹385,"₹3,200",Development,Programming Languages,Git
907,Mathematics for Computer Games Development using Unity,"Penny de Byl, Penny @Holistic3D.com",4.6,"1,220",15 total hours,69 lectures,Beginner,"data:image/svg+xml,%3Csvg xmlns=""http://www.w3.org/2000/svg"" viewBox=""0 0 260 145""%3E%3C/svg%3E",https://www.udemy.com/course/games_mathematics/,"A Beginner's Guide to Essential Mathematics, Data Structures and Algorithms used in Game Programming applied in Unity",₹385,"₹1,280",Development,Game Development,Math
908,Python for Beginners : Concise and Practical,"Patrick Rygula, Samy Mkacher",3.9,"1,215",5.5 total hours,30 lectures,Beginner,"data:image/svg+xml,%3Csvg xmlns=""http://www.w3.org/2000/svg"" viewBox=""0 0 260 145""%3E%3C/svg%3E",https://www.udemy.com/course/python-basics-for-the-beginning-enthusiast/,Learn Python from the beginning and get ready to use it in the future!,₹385,"₹1,280",Development,Programming Languages,Python
909,Mobile App Design from scratch with Sketch 3 : UX and UI,"Maxime Cormier, Adrien Dupuy",4.5,"1,213",10.5 total hours,69 lectures,All Levels,"data:image/svg+xml,%3Csvg xmlns=""http://www.w3.org/2000/svg"" viewBox=""0 0 260 145""%3E%3C/svg%3E",https://www.udemy.com/course/mobile-app-design-from-scratch/,"The new, improved and updated best-selling step by step guide to learn how to design a great mobile app.",₹385,"₹1,600",Development,Mobile Development,Sketch Software
910,Learn C#.Net Core With Real World Examples,Manzoor Ahmed,4.2,"1,218",9 total hours,16 lectures,All Levels,"data:image/svg+xml,%3Csvg xmlns=""http://www.w3.org/2000/svg"" viewBox=""0 0 260 145""%3E%3C/svg%3E",https://www.udemy.com/course/csharp-from-scratch/,"C# with .Net Framework, .Net Core And .Net Standard Libraries. Inheritance, Polymorphism, dlls, Collections with LINQ...",₹385,"₹1,600",Development,Programming Languages,C#
911,MySQL Database Administration: Beginner SQL Database Design,"Maven Analytics, John Pauler",4.5,"1,211",7 total hours,71 lectures,All Levels,"data:image/svg+xml,%3Csvg xmlns=""http://www.w3.org/2000/svg"" viewBox=""0 0 260 145""%3E%3C/svg%3E",https://www.udemy.com/course/mysql-dba-for-beginners/,Learn Database Design with MySQL Workbench. SQL DBA for Beginners: A Relational Database Management System Introduction.,₹385,"₹8,640",Development,Database Design & Development,Database Administration
912,"The Complete Flutter App Development Course for Android, iOS",Smartherd Developers,4.6,"1,208",4.5 total hours,33 lectures,All Levels,"data:image/svg+xml,%3Csvg xmlns=""http://www.w3.org/2000/svg"" viewBox=""0 0 260 145""%3E%3C/svg%3E",https://www.udemy.com/course/the-complete-flutter-app-development-course-for-android-ios/,A Complete Guide to the Flutter Framework for building native iOS and Android apps with single code base,₹556,"₹12,160",Development,Mobile Development,Android Development
913,"Responsive Web & Mobile Development in HTML,CSS & Javascript",QAEversity .,3.7,"1,205",2.5 total hours,17 lectures,Intermediate,"data:image/svg+xml,%3Csvg xmlns=""http://www.w3.org/2000/svg"" viewBox=""0 0 260 145""%3E%3C/svg%3E",https://www.udemy.com/course/complete-web-development-with-html-css-and-javascript/,"Create interactive and responsive web/hybrid mobile apps for android and ios using HTML, CSS and Javascript",₹385,"₹1,280",Development,Web Development,Null
914,The Essential Web Developer Course - Build 12 Websites,Robert Kanaat,4.6,"1,205",16.5 total hours,177 lectures,All Levels,"data:image/svg+xml,%3Csvg xmlns=""http://www.w3.org/2000/svg"" viewBox=""0 0 260 145""%3E%3C/svg%3E",https://www.udemy.com/course/the-essential-web-developer-course/,"From an absolute beginner, to a certified Web developer, this course will teach you the ABCs of Web development.",₹385,"₹8,640",Development,Web Development,Null
915,"SQL Server Analysis Services - SSAS, Data Mining & Analytics",Siddharth Mehta,3.8,"1,203",8 total hours,78 lectures,All Levels,"data:image/svg+xml,%3Csvg xmlns=""http://www.w3.org/2000/svg"" viewBox=""0 0 260 145""%3E%3C/svg%3E",https://www.udemy.com/course/ssas-sql-server-analysis-services-2016-mdx-training/,Develop SSAS cubes from data warehouse on Multidimensional & Tabular modes with Dimensional & Data Mining Models,₹385,"₹8,640",Development,Database Design & Development,SQL Server
916,How the Internet Works & the Web Development Process,YouAccel Training,4.1,"1,200",37 total mins,9 lectures,Beginner,"data:image/svg+xml,%3Csvg xmlns=""http://www.w3.org/2000/svg"" viewBox=""0 0 260 145""%3E%3C/svg%3E",https://www.udemy.com/course/how-the-internet-works-the-web-development-process/,"Learn how the Internet Works - HTTP/HTTPS, Mail Delivery (SMTP), LAN, WAN, Network Basics & Firewalls",₹385,"₹6,400",Development,Web Development,Null
917,Learn Web Designing & HTML5/CSS3 Essentials in 4-Hours,"Brad Hussey, Code College",4.3,"1,199",4 total hours,24 lectures,All Levels,"data:image/svg+xml,%3Csvg xmlns=""http://www.w3.org/2000/svg"" viewBox=""0 0 260 145""%3E%3C/svg%3E",https://www.udemy.com/course/build-beautiful-html5-website/,Convert Photoshop Designs into Stunning HTML5 & CSS3 websites with confidence. Absolutely no prior experience necessary!,₹385,"₹4,800",Development,Web Development,CSS
918,Socket.IO (with websockets) - the details. (socket io v2),Robert Bunch,4.7,"1,199",14 total hours,69 lectures,Intermediate,"data:image/svg+xml,%3Csvg xmlns=""http://www.w3.org/2000/svg"" viewBox=""0 0 260 145""%3E%3C/svg%3E",https://www.udemy.com/course/socketio-with-websockets-the-details/,"Socket io. For those who want to learn how to harness real-time communication on the web. With Cluster, redis, & React",₹385,"₹3,840",Development,Web Development,Socket.IO
919,Build a Social Network with Flutter and Firebase,Reed Barger,4.7,"1,198",9 total hours,63 lectures,All Levels,"data:image/svg+xml,%3Csvg xmlns=""http://www.w3.org/2000/svg"" viewBox=""0 0 260 145""%3E%3C/svg%3E",https://www.udemy.com/course/build-a-social-network-with-flutter-and-firebase/,"Make a complete mobile social media app like Twitter, Instagram or Facebook using Flutter and Firebase!",₹385,"₹1,920",Development,Mobile Development,Firebase
920,Python Django - The Practical Guide,"Academind by Maximilian Schwarzmüller, Maximilian Schwarzmüller",4.7,"1,197",23 total hours,255 lectures,Beginner,"data:image/svg+xml,%3Csvg xmlns=""http://www.w3.org/2000/svg"" viewBox=""0 0 260 145""%3E%3C/svg%3E",https://www.udemy.com/course/python-django-the-practical-guide/,Learn how to build web applications and websites with Python and the Django framework,₹385,"₹8,640",Development,Web Development,Django
921,How to Make a Freaking iPhone App - iOS 10 and Swift 3,Nick Walter,5,"1,197",16 total hours,158 lectures,Beginner,"data:image/svg+xml,%3Csvg xmlns=""http://www.w3.org/2000/svg"" viewBox=""0 0 260 145""%3E%3C/svg%3E",https://www.udemy.com/course/how-to-make-a-freaking-iphone-app-ios-10-swift-3-xcode-8/,iPhone App Development from scratch. Learn how to make iOS apps using Xcode 8. The Basics Include Pokemon Go & Snapchat,₹385,"₹8,640",Development,Mobile Development,Swift
922,Complete Web Developer Course HTML CSS JavaScript PHP jQuery,Laurence Svekis,4,"1,195",22.5 total hours,288 lectures,All Levels,"data:image/svg+xml,%3Csvg xmlns=""http://www.w3.org/2000/svg"" viewBox=""0 0 260 145""%3E%3C/svg%3E",https://www.udemy.com/course/learn-web-development-complete-step-by-step-guide-to-success/,"Complete web developer Guide to websites working with HTML, CSS, JavaScript, PHP, Bootstrap, JQuery, MySQL and more",₹385,"₹8,640",Development,Web Development,Null
923,Maven Crash Course: Step-by-Step Introduction for Beginners,Jason Taylor,4.4,"1,193",2.5 total hours,56 lectures,Beginner,"data:image/svg+xml,%3Csvg xmlns=""http://www.w3.org/2000/svg"" viewBox=""0 0 260 145""%3E%3C/svg%3E",https://www.udemy.com/course/maven-crash-course/,"Quick introduction of core concepts reinforced with practical, ,project-based examples using Maven, Git and Eclipse.",₹385,"₹3,200",Development,Software Development Tools,Apache Maven
924,"TestNG - All in One (Crash Course), Interview question & MCQ",Fast n Easy Learning,4.5,"1,192",6 total hours,67 lectures,All Levels,"data:image/svg+xml,%3Csvg xmlns=""http://www.w3.org/2000/svg"" viewBox=""0 0 260 145""%3E%3C/svg%3E",https://www.udemy.com/course/testng-all-in-one-crash-course/,"In-depth tutorial for TestNG with Maven and Jenkins with Real Time Examples, MCQs, Cheat Sheets and Interview Questions",₹385,"₹6,400",Development,Software Testing,TestNG
925,The Complete Unity Indie Game Developer Course,"Dragan Neskovic, Jasmin Skamo",4.4,"1,191",5 total hours,37 lectures,All Levels,"data:image/svg+xml,%3Csvg xmlns=""http://www.w3.org/2000/svg"" viewBox=""0 0 260 145""%3E%3C/svg%3E",https://www.udemy.com/course/the-complete-unity-indie-game-developer-course/,Learn how to make games by creating a FULL top down RPG and publishing it to the world.,₹385,"₹8,640",Development,Game Development,Game Development Fundamentals
926,"Build Amazing Websites w/ HTML, CSS, Sass, JavaScript & More","Juan E. Galvan, Nahid Akhter",4.5,"1,190",38.5 total hours,166 lectures,All Levels,"data:image/svg+xml,%3Csvg xmlns=""http://www.w3.org/2000/svg"" viewBox=""0 0 260 145""%3E%3C/svg%3E",https://www.udemy.com/course/build-websites-html-css-sass-javascript/,"Learn how to build professional websites & become a front-end developer! [Includes 2 Web Projects, Flexbox, Grid, & SEO]",₹385,"₹8,000",Development,Web Development,CSS
927,Projects in Laravel: Learn Laravel Building 10 Projects,"Eduonix Learning Solutions, Eduonix-Tech ., Samy Eduonix",4.2,"1,189",23 total hours,134 lectures,Intermediate,"data:image/svg+xml,%3Csvg xmlns=""http://www.w3.org/2000/svg"" viewBox=""0 0 260 145""%3E%3C/svg%3E",https://www.udemy.com/course/projects-in-laravel-learn-laravel-building-10-projects/,A complete course to master latest Laravel 5.4 web framework,₹385,"₹3,200",Development,Web Development,Laravel
928,JavaScript Bootcamp - Build Real World Applications,"Code And Create, George Lomidze, Lasha Nozadze",4.5,"1,187",16.5 total hours,120 lectures,All Levels,https://img-c.udemycdn.com/course/240x135/1336656_a6cf_10.jpg,https://www.udemy.com/course/the-ultimate-javascript-course-build-real-world-apps2018/,JavaScript from basic to advanced level. Project - based JavaScript course. JavaScript ES6 guide. Including JSON & AJAX,₹385,"₹1,280",Development,Web Development,JavaScript
929,JavaScript & jQuery - Certification Course for Beginners,YouAccel Training,4.3,"1,183",2.5 total hours,81 lectures,Beginner,"data:image/svg+xml,%3Csvg xmlns=""http://www.w3.org/2000/svg"" viewBox=""0 0 260 145""%3E%3C/svg%3E",https://www.udemy.com/course/javascript-jquery-certification-course-for-beginners/,"Add Animated, Dynamic, Client-Side Functionality to your Web Pages using JavaScript & jQuery",₹385,"₹8,640",Development,Web Development,jQuery
930,Learn Bootstrap - For Beginners,YouAccel Training,4.3,"1,183",3 total hours,44 lectures,Beginner,"data:image/svg+xml,%3Csvg xmlns=""http://www.w3.org/2000/svg"" viewBox=""0 0 260 145""%3E%3C/svg%3E",https://www.udemy.com/course/learn-bootstrap-for-beginners/,Learn to create mobile-responsive web pages using Bootstrap,₹385,"₹6,400",Development,Web Development,Bootstrap
931,JavaScript Ultimate Course,Learn Tech Plus,3.9,"1,179",6 total hours,161 lectures,All Levels,"data:image/svg+xml,%3Csvg xmlns=""http://www.w3.org/2000/svg"" viewBox=""0 0 260 145""%3E%3C/svg%3E",https://www.udemy.com/course/the-learn-javascript-course/,Everything you need to know about Advanced JavaScript,₹385,"₹8,640",Development,Web Development,JavaScript
932,Mathematical Foundation For Machine Learning and AI,"Eduonix Learning Solutions, Eduonix-Tech .",4.2,"1,178",4.5 total hours,19 lectures,All Levels,"data:image/svg+xml,%3Csvg xmlns=""http://www.w3.org/2000/svg"" viewBox=""0 0 260 145""%3E%3C/svg%3E",https://www.udemy.com/course/mathematical-foundation-for-machine-learning-and-ai/,Learn the core mathematical concepts for machine learning and learn to implement them in R and python,₹385,"₹3,200",Development,Data Science,Machine Learning
933,The Complete Guide to Django REST Framework and Vue JS,Michele Saba,4.7,"1,175",13.5 total hours,88 lectures,Intermediate,"data:image/svg+xml,%3Csvg xmlns=""http://www.w3.org/2000/svg"" viewBox=""0 0 260 145""%3E%3C/svg%3E",https://www.udemy.com/course/the-complete-guide-to-django-rest-framework-and-vue-js/,Build Professional REST APIs and Single Page Applications with Django and Vue JS !,₹385,"₹8,640",Development,Web Development,REST API
934,MERN Stack Master Course - Building your own Instagram,Mukesh Phulwani,4.3,"1,175",10.5 total hours,54 lectures,All Levels,"data:image/svg+xml,%3Csvg xmlns=""http://www.w3.org/2000/svg"" viewBox=""0 0 260 145""%3E%3C/svg%3E",https://www.udemy.com/course/mern-stack-master-course-building-your-own-instagram/,"Build Your own Instagram with React, Express, Node.js & MongoDB",₹385,"₹1,280",Development,Web Development,MERN Stack
935,Become a Hadoop Developer |Training|Tutorial ,Nitesh Jain,4.2,"1,170",5 total hours,49 lectures,Intermediate,"data:image/svg+xml,%3Csvg xmlns=""http://www.w3.org/2000/svg"" viewBox=""0 0 260 145""%3E%3C/svg%3E",https://www.udemy.com/course/hadoop-tutorial/,Learn Hadoop and get certified & bag one of the highest paying IT jobs in current times.  ,₹385,"₹1,280",Development,Database Design & Development,Hadoop
936,Introduction to QA Software Testing  Professionalism,Alik Feld,3.9,"1,170",41 total mins,9 lectures,Beginner,"data:image/svg+xml,%3Csvg xmlns=""http://www.w3.org/2000/svg"" viewBox=""0 0 260 145""%3E%3C/svg%3E",https://www.udemy.com/course/introduction-to-sw-qa-testing-professionalism/,Learn QA SW Testing concept and decide if Quality Assurance Testing career is for you,₹385,"₹1,280",Development,Software Testing,Null
937,Docker Swarm: BEGINNER + ADVANCED,Luke Angel,3.5,"1,166",1.5 total hours,28 lectures,Beginner,"data:image/svg+xml,%3Csvg xmlns=""http://www.w3.org/2000/svg"" viewBox=""0 0 260 145""%3E%3C/svg%3E",https://www.udemy.com/course/docker-swarm-from-beginner-to-advanced-with-docker-cluster-hosting/,Learn How To Use Docker Swarm To Manage Docker At Scale,₹385,"₹8,640",Development,Software Development Tools,Docker
938,Node.js for Beginners - Become a Node js Developer + Project,"Edwin Diaz, Coding Faculty Solutions",4.5,"1,165",23 total hours,203 lectures,All Levels,"data:image/svg+xml,%3Csvg xmlns=""http://www.w3.org/2000/svg"" viewBox=""0 0 260 145""%3E%3C/svg%3E",https://www.udemy.com/course/nodejs-for-beginners-become-a-nodejs-developer/,Build an Amazing CMS system - Using Express + MongoDB + Bootstrap - Handlebars + Authentication + AJAX + Deployment,₹385,"₹8,640",Development,Web Development,Node.Js
939,Unified Modeling Language (UML): Complete Guide & Examples,Maged Koshty,4.1,"1,164",4 total hours,50 lectures,All Levels,"data:image/svg+xml,%3Csvg xmlns=""http://www.w3.org/2000/svg"" viewBox=""0 0 260 145""%3E%3C/svg%3E",https://www.udemy.com/course/uml-the-complete-uml-unified-modeling-language-reference/,"An online course to Learn how to read UML diagrams, interpret every UML notation and build them using practical examples",₹385,"₹8,640",Development,Software Engineering,UML
940,Create eLearning Courses with Articulate Storyline 360,Jeff Batt,4.5,"1,162",14.5 total hours,166 lectures,Beginner,"data:image/svg+xml,%3Csvg xmlns=""http://www.w3.org/2000/svg"" viewBox=""0 0 260 145""%3E%3C/svg%3E",https://www.udemy.com/course/create-elearning-courses-with-articulate-storyline-360-or-3/,In this course we cover everything from A-Z within Articulate Storyline.,₹385,"₹8,640",Development,Software Development Tools,Articulate Storyline
941,Ultimate WordPress Plugin Course,"Code College, Joel Funk",4.5,"1,162",10.5 total hours,53 lectures,All Levels,"data:image/svg+xml,%3Csvg xmlns=""http://www.w3.org/2000/svg"" viewBox=""0 0 260 145""%3E%3C/svg%3E",https://www.udemy.com/course/wordpress-plugin-course/,"Learn how to Plan, Code and Publish WordPress Plugins in this step-by-step course by an Expert Developer",₹385,"₹6,400",Development,Web Development,WordPress
942,PHP Unit Testing with PHPUnit,Dave Hollingworth,4.6,"1,161",2.5 total hours,48 lectures,Intermediate,"data:image/svg+xml,%3Csvg xmlns=""http://www.w3.org/2000/svg"" viewBox=""0 0 260 145""%3E%3C/svg%3E",https://www.udemy.com/course/php-unit-testing/,"Unit test your PHP code using the PHPUnit testing framework: find bugs quickly and early, and improve your code quality.",₹385,"₹8,000",Development,Web Development,PHP
943,The complete React Native course ( 2021 edition ),Coding Revolution,4.6,"1,158",42.5 total hours,243 lectures,Beginner,"data:image/svg+xml,%3Csvg xmlns=""http://www.w3.org/2000/svg"" viewBox=""0 0 260 145""%3E%3C/svg%3E",https://www.udemy.com/course/the-complete-react-native-course-create-beautiful-apps/,Take you coding to the next level with React Native.,₹385,"₹1,280",Development,Mobile Development,React Native
944,Build Incredible Chatbots,Sachin Bhatnagar,3.8,"1,158",8 total hours,94 lectures,All Levels,https://img-c.udemycdn.com/course/240x135/875194_5029_4.jpg,https://www.udemy.com/course/build-incredible-chatbots/,"Learn to build and deploy chatbots for Facebook Messenger, WhatsApp, Slack and Skype using Wit & DialogFlow!",₹385,"₹8,000",Development,Web Development,Chatbot
945,Artificial Intelligence Masterclass,"Hadelin de Ponteves, Kirill Eremenko, Ligency Team",4.6,"1,156",12 total hours,89 lectures,Beginner,"data:image/svg+xml,%3Csvg xmlns=""http://www.w3.org/2000/svg"" viewBox=""0 0 260 145""%3E%3C/svg%3E",https://www.udemy.com/course/artificial-intelligence-masterclass/,"Enter the new era of Hybrid AI Models optimized by Deep NeuroEvolution, with a complete toolkit of ML, DL & AI models",₹385,"₹8,640",Development,Data Science,Artificial Intelligence
946,ChatBots: How to Make a Facebook Messenger Chat Bot in 1hr,Stefan Kojouharov,3.8,"1,155",2 total hours,44 lectures,Beginner,"data:image/svg+xml,%3Csvg xmlns=""http://www.w3.org/2000/svg"" viewBox=""0 0 260 145""%3E%3C/svg%3E",https://www.udemy.com/course/chatbots-how-to-make-chat-bot-for-facebook-messenger/,We will Create a Parrot Bot Together! This course is a Step by Step Guide in Building a Chat Bot for Facebook Messenger,₹385,"₹1,280",Development,Web Development,Chatbot
947,Git from Basics to Advanced: Practical Guide for Developers,"Andrii Piatakha, Learn IT University",4.4,"1,152",3.5 total hours,22 lectures,All Levels,"data:image/svg+xml,%3Csvg xmlns=""http://www.w3.org/2000/svg"" viewBox=""0 0 260 145""%3E%3C/svg%3E",https://www.udemy.com/course/git-learnit/,Learn Git from basics to advanced level. During the course we will create our own project that we will manage with Git,₹385,"₹3,840",Development,Software Development Tools,Git
948,Python 101,Kris Yamarthy,4.1,"1,150",17 total hours,113 lectures,All Levels,"data:image/svg+xml,%3Csvg xmlns=""http://www.w3.org/2000/svg"" viewBox=""0 0 260 145""%3E%3C/svg%3E",https://www.udemy.com/course/kypython-101/,"Learn Regular Expressions, NumPy, Pandas, OOP and Database programming in addition to basic Python.",₹385,"₹8,640",Development,Programming Languages,Python
949,Automated Software Testing with Cypress,Kaniel Outis,4.5,"1,148",15 total hours,187 lectures,All Levels,"data:image/svg+xml,%3Csvg xmlns=""http://www.w3.org/2000/svg"" viewBox=""0 0 260 145""%3E%3C/svg%3E",https://www.udemy.com/course/automated-testing-with-cypress/,"Learn latest Cypress v7.0+, Automation Framework, Visual Testing, Cucumber, Docker, Dashboard + Jenkins and API Testing!",₹385,"₹1,280",Development,Software Testing,Cypress.io
950,Unit Testing .Net Core Applications with xUnit .net & MOQ,Aref K.,4.2,"1,148",3.5 total hours,39 lectures,All Levels,"data:image/svg+xml,%3Csvg xmlns=""http://www.w3.org/2000/svg"" viewBox=""0 0 260 145""%3E%3C/svg%3E",https://www.udemy.com/course/unit-testing-net-core-2x-applications-with-xunit-net/,"Mocking Techniques, Test Driven Development (TDD), and Unit Testing Legacy Code with xUnit. NET + Interview Questions",₹385,"₹6,400",Development,Software Testing,Unit Testing
951,U&P AI - Natural Language Processing (NLP) with Python,Abdulhadi Darwish,4,"1,146",6 total hours,72 lectures,Beginner,"data:image/svg+xml,%3Csvg xmlns=""http://www.w3.org/2000/svg"" viewBox=""0 0 260 145""%3E%3C/svg%3E",https://www.udemy.com/course/understand-and-practice-ai-natural-language-processing-in-python/,"Become an NLP Engineer by creating real projects using Python, semantic search, text mining and search engines!",₹385,"₹1,280",Development,Data Science,Natural Language Processing
