443,Windows Presentation Foundation Masterclass,"Tim Buchalka's Learn Programming Academy, Eduardo Rosas",4.5,"2,746",20.5 total hours,132 lectures,All Levels,"data:image/svg+xml,%3Csvg xmlns=""http://www.w3.org/2000/svg"" viewBox=""0 0 260 145""%3E%3C/svg%3E",https://www.udemy.com/course/windows-presentation-foundation-masterclass/,"Leverage WPF with C# and XAML to build real world skills with Azure, REST, MVVM and Machine Learning",₹556,"₹6,400",Development,Programming Languages,Windows Presentation Foundation
444,PHP & MySQL - Certification Course for Beginners,YouAccel Training,4.3,"2,743",3.5 total hours,57 lectures,Beginner,"data:image/svg+xml,%3Csvg xmlns=""http://www.w3.org/2000/svg"" viewBox=""0 0 260 145""%3E%3C/svg%3E",https://www.udemy.com/course/php-mysql-certification-course-for-beginners/,Learn to Build Database Driven Web Applications using PHP & MySQL,₹385,"₹8,640",Development,Web Development,PHP
445,The Complete Sass & SCSS Course: From Beginner to Advanced,"Joe Parys, Peter Sommerhoff, Joe Parys Support",4.4,"2,741",4 total hours,41 lectures,All Levels,"data:image/svg+xml,%3Csvg xmlns=""http://www.w3.org/2000/svg"" viewBox=""0 0 260 145""%3E%3C/svg%3E",https://www.udemy.com/course/sasscourse/,No more cluttered CSS! Realize clean designs lightning-fast and without frustration using Sass & SCSS.,₹385,"₹8,640",Development,Web Development,Sass
446,Shader Development from Scratch for Unity with Cg,"Penny de Byl, Penny @Holistic3D.com",4.7,"2,722",10.5 total hours,77 lectures,Intermediate,"data:image/svg+xml,%3Csvg xmlns=""http://www.w3.org/2000/svg"" viewBox=""0 0 260 145""%3E%3C/svg%3E",https://www.udemy.com/course/unity-shaders/,Learn to program the graphics pipeline in Unity for creating unique visual surfaces for game objects.,₹385,"₹1,280",Development,Game Development,Unity
447,Build a Blockchain and a Cryptocurrency from Scratch,David Joseph Katz,4.7,"2,719",6.5 total hours,71 lectures,Intermediate,"data:image/svg+xml,%3Csvg xmlns=""http://www.w3.org/2000/svg"" viewBox=""0 0 260 145""%3E%3C/svg%3E",https://www.udemy.com/course/build-blockchain/,Build a blockchain and cryptocurrency. Discover the engineering ideas behind technologies like Bitcoin and Ethereum!,₹385,"₹8,640",Development,Software Engineering,Cryptocurrency
448,ISTQB Foundation Level 2021 Complete Training,"Tarek Roshdy, Nezam Academy",4.6,"2,722",13 total hours,155 lectures,Beginner,https://img-c.udemycdn.com/course/240x135/3292616_0a27_2.jpg,https://www.udemy.com/course/foundation-level-training/,The best way to prepare for the ISTQB Foundation Level Exam,₹385,"₹2,240",Development,Software Testing,ISTQB Certified Tester Foundation Level (CTFL)
449,Modern Web Scraping with Python using Scrapy Splash Selenium,Ahmed Rafik,4.7,"2,711",9 total hours,128 lectures,All Levels,"data:image/svg+xml,%3Csvg xmlns=""http://www.w3.org/2000/svg"" viewBox=""0 0 260 145""%3E%3C/svg%3E",https://www.udemy.com/course/web-scraping-in-python-using-scrapy-and-splash/,"Become an expert in web scraping and web crawling using Python 3, Scrapy, Splash and Selenium 2nd EDITION (2021)",₹385,"₹1,920",Development,Programming Languages,Web Scraping
450,Apache Spark 2.0 with Java -Learn Spark from a Big Data Guru,"Tao W., James Lee, Level Up",4.4,"2,709",3.5 total hours,60 lectures,All Levels,"data:image/svg+xml,%3Csvg xmlns=""http://www.w3.org/2000/svg"" viewBox=""0 0 260 145""%3E%3C/svg%3E",https://www.udemy.com/course/apache-spark-course-with-java/,Learn analyzing large data sets with Apache Spark by 10+ hands-on examples. Take your big data skills to the next level.,₹385,"₹8,640",Development,Software Development Tools,Apache Spark
451,Data Structures A-Z : Data Structures + Algorithms Bootcamp,Vinoth Parthasarathy,4.8,"2,708",7.5 total hours,87 lectures,All Levels,"data:image/svg+xml,%3Csvg xmlns=""http://www.w3.org/2000/svg"" viewBox=""0 0 260 145""%3E%3C/svg%3E",https://www.udemy.com/course/data-structures-and-algorithms-the-complete-guide/,Become ace in data structures & algorithms & Crack the code interview by getting mastery in data structures & algorithms,₹385,"₹8,640",Development,Programming Languages,Data Structures
452,The Comprehensive 2021 Android Development Masterclass,"Paulo Dichone | Android, Java, Flutter Developer and Teacher",4.5,"2,709",49.5 total hours,388 lectures,All Levels,"data:image/svg+xml,%3Csvg xmlns=""http://www.w3.org/2000/svg"" viewBox=""0 0 260 145""%3E%3C/svg%3E",https://www.udemy.com/course/android-development-java-android-studio-masterclass/,"Master Modern Android API's: ROOM Database, ML Kit Face Recognition, Firestore, Firebase, Maps and Android Studio IDE",₹556,"₹12,160",Development,Mobile Development,Android Development
453,The Rust Programming Language,Dmitri Nesteruk,4.3,"2,702",8.5 total hours,61 lectures,All Levels,"data:image/svg+xml,%3Csvg xmlns=""http://www.w3.org/2000/svg"" viewBox=""0 0 260 145""%3E%3C/svg%3E",https://www.udemy.com/course/rust-lang/,"Learn a modern, powerful yet safe systems programming language!",₹385,"₹6,400",Development,Programming Languages,Rust (programming language)
454,Selenium WebDriver with C# for Beginners + Live Testing Site,Tod Vachev,4.5,"2,699",5 total hours,57 lectures,All Levels,"data:image/svg+xml,%3Csvg xmlns=""http://www.w3.org/2000/svg"" viewBox=""0 0 260 145""%3E%3C/svg%3E",https://www.udemy.com/course/seleniumqa/,Selenium is the most popular tool to test websites! Join me and hundreds of students to learn Selenium Webdriver!,₹385,"₹8,640",Development,Software Testing,Selenium WebDriver
455,"Java from Zero to First Job - Practical Guide, 600+ examples","Andrii Piatakha, Learn IT University",4.5,"2,697",31 total hours,145 lectures,All Levels,"data:image/svg+xml,%3Csvg xmlns=""http://www.w3.org/2000/svg"" viewBox=""0 0 260 145""%3E%3C/svg%3E",https://www.udemy.com/course/java-development-for-beginners-learnit/,"Learn Java from scratch and become Java Software Engineer: Basics, OOP, Interview questions, Git, Java Collections etc",₹385,"₹6,400",Development,Programming Languages,Java
456,MATLAB Master Class: Go from Beginner to Expert in MATLAB,Nouman Azam,4.5,"2,687",43 total hours,343 lectures,All Levels,"data:image/svg+xml,%3Csvg xmlns=""http://www.w3.org/2000/svg"" viewBox=""0 0 260 145""%3E%3C/svg%3E",https://www.udemy.com/course/matlab-essentials-for-engineering-and-science-students/,"MATLAB programming,data analysis, visualization, reports generation, scripting, data Science, GUI's, regular expressions",₹385,"₹8,640",Development,Programming Languages,MATLAB
457,Go Bootcamp: Master Golang with 1000+ Exercises and Projects,"Jose Portilla, Inanc Gumus",4.4,"2,684",16 total hours,196 lectures,All Levels,"data:image/svg+xml,%3Csvg xmlns=""http://www.w3.org/2000/svg"" viewBox=""0 0 260 145""%3E%3C/svg%3E",https://www.udemy.com/course/learn-go-the-complete-bootcamp-course-golang/,Master and Deeply Understand Google's Go from Scratch with Illustrated In-Depth Tutorials & 1000+ Hands-On Exercises.,₹385,"₹8,640",Development,Programming Languages,Go (programming language)
458,Data Structure and  Algorithms Analysis - Job Interview,Dr. Hussein Alrubaye,4.2,"2,684",15.5 total hours,101 lectures,All Levels,"data:image/svg+xml,%3Csvg xmlns=""http://www.w3.org/2000/svg"" viewBox=""0 0 260 145""%3E%3C/svg%3E",https://www.udemy.com/course/data-structure-and-algorithms-analysis/,"Write code run faster, use less memory and prepare for Software Engineer Interview with real interview questions",₹385,"₹1,280",Development,Programming Languages,Interviewing Skills
459,Introduction to Data Structures & Algorithms in Java,Raghavendra Dixit,4.6,"2,683",5 total hours,103 lectures,All Levels,"data:image/svg+xml,%3Csvg xmlns=""http://www.w3.org/2000/svg"" viewBox=""0 0 260 145""%3E%3C/svg%3E",https://www.udemy.com/course/introduction-to-data-structures-algorithms-in-java/,Designed to help understand the fundamentals of DS & Algorithms really well. A must have for programming interviews.,₹385,"₹4,160",Development,Software Engineering,Java Algorithms
460,Intro to Data Science: Your Step-by-Step Guide To Starting,"Kirill Eremenko, Hadelin de Ponteves, Ligency Team",4.4,"2,674",5.5 total hours,42 lectures,Beginner,"data:image/svg+xml,%3Csvg xmlns=""http://www.w3.org/2000/svg"" viewBox=""0 0 260 145""%3E%3C/svg%3E",https://www.udemy.com/course/intro-to-data-science/,"Learn the critical elements of Data Science, from visualization to databases to Python and more, in just 6 weeks!",₹385,"₹8,640",Development,Data Science,Null
461,"JSP, Servlet, JSLT + Hibernate: A complete guide","StudyEasy Organisation, Chaand Sheikh",4.5,"2,649",13 total hours,144 lectures,Intermediate,"data:image/svg+xml,%3Csvg xmlns=""http://www.w3.org/2000/svg"" viewBox=""0 0 260 145""%3E%3C/svg%3E",https://www.udemy.com/course/jsp-servlet-free-course/,A JSP (Java server pages) & Servlet + Hibernate: Quick course,₹385,"₹8,320",Development,Web Development,JSP
462,Kotlin for Android: Beginner to Advanced,Devslopes by Mark Wahlbeck,4.1,"2,644",23 total hours,101 lectures,Beginner,"data:image/svg+xml,%3Csvg xmlns=""http://www.w3.org/2000/svg"" viewBox=""0 0 260 145""%3E%3C/svg%3E",https://www.udemy.com/course/devslopes-android-kotlin/,"Kotlin is an expressive, concise & powerful development language on Android. Learn everything you need to know to start",₹556,"₹12,160",Development,Mobile Development,Kotlin
463,Kotlin for Java Developers,"Tim Buchalka, Goran Lochert, Tim Buchalka's Learn Programming Academy",4.5,"2,644",17 total hours,90 lectures,All Levels,"data:image/svg+xml,%3Csvg xmlns=""http://www.w3.org/2000/svg"" viewBox=""0 0 260 145""%3E%3C/svg%3E",https://www.udemy.com/course/kotlin-for-java-developers/,"Use your Java skills to learn Kotlin fast. Enhance career prospects and master Kotlin, including Java interoperability",₹385,"₹6,400",Development,Programming Languages,Kotlin
464,"Complete Guide to Protocol Buffers 3 [Java, Golang, Python]","Stephane Maarek | AWS Certified Cloud Practitioner,Solutions Architect,Developer",4.7,"2,647",3.5 total hours,69 lectures,Beginner,"data:image/svg+xml,%3Csvg xmlns=""http://www.w3.org/2000/svg"" viewBox=""0 0 260 145""%3E%3C/svg%3E",https://www.udemy.com/course/protocol-buffers/,Google Protobuf with examples and exercises. Code in Java Go Python. Say Goodbye to JSON & XML. Pre-req to gRPC,₹385,"₹6,400",Development,Programming Languages,Data Storage
465,Reactive Angular Course (with RxJs),Angular University,4.6,"2,631",5.5 total hours,41 lectures,All Levels,"data:image/svg+xml,%3Csvg xmlns=""http://www.w3.org/2000/svg"" viewBox=""0 0 260 145""%3E%3C/svg%3E",https://www.udemy.com/course/rxjs-reactive-angular-course/,"Build Angular 12 Applications in Reactive style with plain RxJs - Patterns, Anti-Patterns, Lightweight State Management",₹385,"₹8,640",Development,Web Development,RxJs
466,Monitoring and Alerting with Prometheus,"Edward Viaene, Jorn Jambers",4.3,"2,624",4 total hours,37 lectures,Beginner,"data:image/svg+xml,%3Csvg xmlns=""http://www.w3.org/2000/svg"" viewBox=""0 0 260 145""%3E%3C/svg%3E",https://www.udemy.com/course/monitoring-and-alerting-with-prometheus/,"Become a DevOps monitoring expert using Prometheus and Grafana, monitor your infrastructure and applications as a pro.",₹385,"₹1,600",Development,Software Development Tools,Prometheus Software
467,AWS Certified Machine Learning Specialty (MLS-C01),Chandra Lingam,4.6,"2,616",17.5 total hours,240 lectures,All Levels,"data:image/svg+xml,%3Csvg xmlns=""http://www.w3.org/2000/svg"" viewBox=""0 0 260 145""%3E%3C/svg%3E",https://www.udemy.com/course/aws-machine-learning-a-complete-guide-with-python/,Hands on AWS SageMaker Course with Practice Test,₹385,"₹8,640",Development,Data Science,Machine Learning
468,Build a Social Network from Scratch: JavaScript PHP + MySQL,Reece Kenney,4.5,"2,611",17 total hours,180 lectures,All Levels,"data:image/svg+xml,%3Csvg xmlns=""http://www.w3.org/2000/svg"" viewBox=""0 0 260 145""%3E%3C/svg%3E",https://www.udemy.com/course/make-a-social-media-website/,"Learn JavaScript, PHP and MySQL by building the ultimate social network website from scratch! The complete guide!",₹556,"₹3,200",Development,Web Development,PHP
469,Learn Python: Python for Beginners,Abrar Hussain,4.3,"2,598",1.5 total hours,27 lectures,Beginner,"data:image/svg+xml,%3Csvg xmlns=""http://www.w3.org/2000/svg"" viewBox=""0 0 260 145""%3E%3C/svg%3E",https://www.udemy.com/course/learn-python/,Python introduction for beginners. Learn complete Python from scratch!,₹385,"₹1,920",Development,Programming Languages,Python
470,Modern Deep Learning in Python,Lazy Programmer Inc.,4.6,"2,595",11.5 total hours,90 lectures,All Levels,"data:image/svg+xml,%3Csvg xmlns=""http://www.w3.org/2000/svg"" viewBox=""0 0 260 145""%3E%3C/svg%3E",https://www.udemy.com/course/data-science-deep-learning-in-theano-tensorflow/,"Build with modern libraries like Tensorflow, Theano, Keras, PyTorch, CNTK, MXNet. Train faster with GPU on AWS.",₹385,"₹8,640",Development,Data Science,Deep Learning
471,Flutter & Firebase: Build a Complete App for iOS & Android,Andrea Bizzotto,4.6,"2,584",21 total hours,411 lectures,All Levels,"data:image/svg+xml,%3Csvg xmlns=""http://www.w3.org/2000/svg"" viewBox=""0 0 260 145""%3E%3C/svg%3E",https://www.udemy.com/course/flutter-firebase-build-a-complete-app-for-ios-android/,"Learn Dart, Flutter & Firebase by Google, and build a real-world, production ready app",₹556,"₹12,160",Development,Mobile Development,Google Flutter
472,Learn Core JAVA Programming - Beginner to Master,Abdul Bari,4.7,"2,569",61.5 total hours,333 lectures,All Levels,"data:image/svg+xml,%3Csvg xmlns=""http://www.w3.org/2000/svg"" viewBox=""0 0 260 145""%3E%3C/svg%3E",https://www.udemy.com/course/java-se-programming/,Deep Dive in Core Java programming -Standard Edition. A Practical approach to learn Java. Become a Java Expert,₹385,"₹8,640",Development,Programming Languages,Java
473,The Full Stack Web Development,"Eduonix Learning Solutions, Eduonix-Tech ., Samy Eduonix",4.4,"2,564",33 total hours,208 lectures,Beginner,"data:image/svg+xml,%3Csvg xmlns=""http://www.w3.org/2000/svg"" viewBox=""0 0 260 145""%3E%3C/svg%3E",https://www.udemy.com/course/the-full-stack-web-development/,Learn Full Stack Web Development Building Over 40+ Projects,₹385,"₹3,840",Development,Web Development,Null
474,"Docker - Introducing Docker Essentials, Containers, and more",David Joseph Katz,4.3,"2,556",6 total hours,47 lectures,All Levels,"data:image/svg+xml,%3Csvg xmlns=""http://www.w3.org/2000/svg"" viewBox=""0 0 260 145""%3E%3C/svg%3E",https://www.udemy.com/course/docker-containers/,"Create and run Docker containers, and build multi-container applications. Compose, Networks, Swarm, Cloud, & more!",₹385,"₹8,640",Development,Software Engineering,Docker
475,Python Programming From A-Z: Beginner To Expert Course,"Juan E. Galvan, Ahmed Wael",4.4,"2,555",16 total hours,156 lectures,All Levels,"data:image/svg+xml,%3Csvg xmlns=""http://www.w3.org/2000/svg"" viewBox=""0 0 260 145""%3E%3C/svg%3E",https://www.udemy.com/course/learn-python-programming-from-a-z/,"Become a professional Python programmer and learn how to easily create programs, apps, scripts, games and so much more!",₹385,"₹8,640",Development,Programming Languages,Python
476,Selenium WebDriver MasterClass (Basic + Advance + Architect),LevelUp360° DevOps,4.5,"2,550",48 total hours,226 lectures,All Levels,"data:image/svg+xml,%3Csvg xmlns=""http://www.w3.org/2000/svg"" viewBox=""0 0 260 145""%3E%3C/svg%3E",https://www.udemy.com/course/selenium-webdriver-web-based-automation-testing/,Java Selenium WebDriver with Framework Designing from Scratch using TestNG POM DataDriver Selenium Frameworks Cucumber,₹385,"₹8,640",Development,Software Testing,Selenium WebDriver
477,Standard 9.1- Part 2 Certified Enterprise Architect Course,"Scott Duffy  • 550.000+ Students, Software Architect.ca",4.3,"2,550",2.5 total hours,31 lectures,All Levels,"data:image/svg+xml,%3Csvg xmlns=""http://www.w3.org/2000/svg"" viewBox=""0 0 260 145""%3E%3C/svg%3E",https://www.udemy.com/course/togaf-part2/,Learn about the TOGAF 9.1 Standard and prepare for the certification Level 2 Certified.,₹385,"₹8,000",Development,Software Engineering,TOGAF 9 Certified
478,Selenium WebDriver with Java | Project Implement + Framework,T World,4.3,"2,549",41 total hours,368 lectures,All Levels,"data:image/svg+xml,%3Csvg xmlns=""http://www.w3.org/2000/svg"" viewBox=""0 0 260 145""%3E%3C/svg%3E",https://www.udemy.com/course/selenium-with-java/,"Selenium Webdriver Automation Testing, BDD/ Cucumber framework, End to End integration with Jenkins, Katalon Studio",₹385,"₹8,640",Development,Software Testing,Selenium Testing Framework
479,C Programming Step by Step - Complete Tutorial For Beginners,Shibaji Paul,4.4,"2,547",17.5 total hours,153 lectures,All Levels,"data:image/svg+xml,%3Csvg xmlns=""http://www.w3.org/2000/svg"" viewBox=""0 0 260 145""%3E%3C/svg%3E",https://www.udemy.com/course/c-for-technical-interview/,"C language tutorial from basics with C operator,loop,array,pointer,function,parameter,string,recursion,structure,file.",₹385,"₹8,640",Development,Programming Languages,C (programming language)
480,Learn To Code By Making a 2D Platformer in Unity,James Doyle,4.8,"2,544",13 total hours,84 lectures,Beginner,https://img-c.udemycdn.com/course/240x135/775550_453b_3.jpg,https://www.udemy.com/course/unity2dplatformer/,Game development made easy. Learn C# using Unity and create your very own 2D Platformer,₹385,"₹2,240",Development,Game Development,Unity
481,Artificial Intelligence for Business,"Hadelin de Ponteves, Kirill Eremenko, SuperDataScience Team",4.5,"2,543",15 total hours,118 lectures,Beginner,"data:image/svg+xml,%3Csvg xmlns=""http://www.w3.org/2000/svg"" viewBox=""0 0 260 145""%3E%3C/svg%3E",https://www.udemy.com/course/ai-for-business/,Solve Real World Business Problems with AI Solutions,₹385,"₹8,640",Development,Data Science,Artificial Intelligence
482,Introduction to Natural Language Processing (NLP),Brian Sacash,4.3,"2,543",3 total hours,41 lectures,Beginner,"data:image/svg+xml,%3Csvg xmlns=""http://www.w3.org/2000/svg"" viewBox=""0 0 260 145""%3E%3C/svg%3E",https://www.udemy.com/course/natural-language-processing/,Learn how to analyze text data.,₹385,"₹6,400",Development,Data Science,Natural Language Processing
483,Docker for Java Developers,John Thompson,4.5,"2,541",10.5 total hours,105 lectures,Intermediate,"data:image/svg+xml,%3Csvg xmlns=""http://www.w3.org/2000/svg"" viewBox=""0 0 260 145""%3E%3C/svg%3E",https://www.udemy.com/course/docker-for-java-developers/,Learn how you can use Docker to supercharge your enterprise Java Development!,₹385,"₹8,640",Development,Software Engineering,Docker
484,Machine Learning with Javascript,Stephen Grider,4.6,"2,537",17.5 total hours,187 lectures,Beginner,"data:image/svg+xml,%3Csvg xmlns=""http://www.w3.org/2000/svg"" viewBox=""0 0 260 145""%3E%3C/svg%3E",https://www.udemy.com/course/machine-learning-with-javascript/,Master Machine Learning from scratch using Javascript and TensorflowJS with hands-on projects.,₹385,"₹8,640",Development,Data Science,Machine Learning
485,"React JS, Angular & Vue JS - Quickstart & Comparison","Maximilian Schwarzmüller, Academind by Maximilian Schwarzmüller",4.7,"2,535",8 total hours,144 lectures,Beginner,"data:image/svg+xml,%3Csvg xmlns=""http://www.w3.org/2000/svg"" viewBox=""0 0 260 145""%3E%3C/svg%3E",https://www.udemy.com/course/angular-reactjs-vuejs-quickstart-comparison/,"Angular (Angular 2+), React or Vue? Get a Crash Course on each of them and a detailed comparison!",₹385,"₹8,640",Development,Web Development,Vue JS
486,Next.js & React - The Complete Guide (incl. Two Paths!),"Maximilian Schwarzmüller, Academind by Maximilian Schwarzmüller",4.8,"2,545",25 total hours,270 lectures,All Levels,"data:image/svg+xml,%3Csvg xmlns=""http://www.w3.org/2000/svg"" viewBox=""0 0 260 145""%3E%3C/svg%3E",https://www.udemy.com/course/nextjs-react-the-complete-guide/,"Learn NextJS from the ground up and build production-ready, fullstack ReactJS apps with the NextJS framework!",₹385,"₹8,640",Development,Web Development,Next.js
487,R Programming For Absolute Beginners,Bogdan Anastasiei,4.6,"2,532",9.5 total hours,119 lectures,Beginner,"data:image/svg+xml,%3Csvg xmlns=""http://www.w3.org/2000/svg"" viewBox=""0 0 260 145""%3E%3C/svg%3E",https://www.udemy.com/course/r-programming-course-for-absolute-beginners/,Learn the basics of writing code in R - your first step to become a data scientist,₹385,"₹2,560",Development,Data Science,R (programming language)
488,AWS Certified Developer Associate Practice Exams,"Jon Bonso | AWS Solutions Architect,AWS Certified Cloud Practitioner, Tutorials Dojo | AWS Certified Cloud Practitioner, AWS Certified Solutions Architect, AWS Certified Developer, Carlo Acebedo | AWS Certified Developer Associate | AWS Professional",4.7,"2,529",335 questions,All Levels,Null,"data:image/svg+xml,%3Csvg xmlns=""http://www.w3.org/2000/svg"" viewBox=""0 0 260 145""%3E%3C/svg%3E",https://www.udemy.com/course/aws-certified-developer-associate-practice-exams-amazon/,Be an AWS Certified Developer! Covers AWS Certified Developer topics to pass the AWS Certified Developer Associate exam!,₹385,"₹1,920",IT & Software,IT Certifications,AWS Certification
489,R Level 1 - Data Analytics with R,R-Tutorials Training,4.5,"2,522",8.5 total hours,87 lectures,Beginner,"data:image/svg+xml,%3Csvg xmlns=""http://www.w3.org/2000/svg"" viewBox=""0 0 260 145""%3E%3C/svg%3E",https://www.udemy.com/course/r-level1/,Use R for Data Analytics and Data Mining,₹385,"₹8,640",Development,Data Science,R (programming language)
490,Complete ASP NET MVC Web Development - Newbie to Ninja!,Brett Hargreaves,4.3,"2,518",15.5 total hours,92 lectures,All Levels,"data:image/svg+xml,%3Csvg xmlns=""http://www.w3.org/2000/svg"" viewBox=""0 0 260 145""%3E%3C/svg%3E",https://www.udemy.com/course/better-web-development-pro-techniques-for-success/,Quickly Learn Web Development with ASP NET MVC and C#. From absolute basics to ninja! Learn C# and MVC like a Pro,₹385,"₹1,920",Development,Web Development,ASP.NET MVC
491,Unreal Engine C++ The Ultimate Game Developer Course,Stephen Ulibarri,4.6,"2,511",34.5 total hours,100 lectures,All Levels,"data:image/svg+xml,%3Csvg xmlns=""http://www.w3.org/2000/svg"" viewBox=""0 0 260 145""%3E%3C/svg%3E",https://www.udemy.com/course/unreal-engine-the-ultimate-game-developer-course/,"Learn how to develop, code and package a complete video game in Unreal Engine",₹385,"₹8,640",Development,Game Development,Unreal Engine
492,React JS- Complete Guide for Frontend Web Development [2021],"EdYoda Digital University, Qaifi Khan, Mavludin Abdulkadirov",4.4,"2,506",22 total hours,202 lectures,All Levels,"data:image/svg+xml,%3Csvg xmlns=""http://www.w3.org/2000/svg"" viewBox=""0 0 260 145""%3E%3C/svg%3E",https://www.udemy.com/course/react-js-a-complete-guide-for-frontend-web-development/,"Become an expert React JS Developer. Learn HTML, CSS, JavaScript, ES6, React JS and jQuery.",₹385,"₹6,400",Development,Web Development,React
493,"Python Programming Bible | Networking, GUI, Email, XML, CGI",Frahaan Hussain,4,"2,505",6 total hours,97 lectures,All Levels,"data:image/svg+xml,%3Csvg xmlns=""http://www.w3.org/2000/svg"" viewBox=""0 0 260 145""%3E%3C/svg%3E",https://www.udemy.com/course/pythonv3/,"Python 3 is one of the most popular programming languages. Companies like Facebook, Microsoft and Apple all want Python",₹385,"₹8,640",Development,Programming Languages,Python
494,PyTorch for Deep Learning with Python Bootcamp,Jose Portilla,4.7,"2,486",17 total hours,97 lectures,All Levels,"data:image/svg+xml,%3Csvg xmlns=""http://www.w3.org/2000/svg"" viewBox=""0 0 260 145""%3E%3C/svg%3E",https://www.udemy.com/course/pytorch-for-deep-learning-with-python-bootcamp/,Learn how to create state of the art neural networks for deep learning with Facebook's PyTorch Deep Learning library!,₹385,"₹8,640",Development,Data Science,Deep Learning
495,Scrapy: Powerful Web Scraping & Crawling with Python,"GoTrained Academy, Lazar Telebak",4.5,"2,480",11 total hours,86 lectures,All Levels,"data:image/svg+xml,%3Csvg xmlns=""http://www.w3.org/2000/svg"" viewBox=""0 0 260 145""%3E%3C/svg%3E",https://www.udemy.com/course/scrapy-tutorial-web-scraping-with-python/,"Python Scrapy Tutorial - Learn how to scrape websites and build a powerful web crawler using Scrapy, Splash and Python",₹385,"₹6,400",Development,Programming Languages,Web Scraping
496,"SQL Bootcamp with MySQL, PHP & Python : 5 Courses in 1",Creative Online School,4.1,"2,469",3 total hours,36 lectures,All Levels,https://img-c.udemycdn.com/course/240x135/1508458_5030.jpg,https://www.udemy.com/course/complete-sql-bootcamp-with-mysql-php-python/,"Master yourself in SQL, do practical projects with MySQL, PHP and Python",₹385,"₹8,640",Development,Database Design & Development,MySQL
497,The Complete React Js & Redux Course - Build Modern Web Apps,"Codestars by Rob Percival, Rayan Slim, Rob Percival, Jad Slim",4.5,"2,466",8.5 total hours,71 lectures,All Levels,"data:image/svg+xml,%3Csvg xmlns=""http://www.w3.org/2000/svg"" viewBox=""0 0 260 145""%3E%3C/svg%3E",https://www.udemy.com/course/the-complete-react-js-redux-course-build-modern-web-apps/,"Go from Beginner to React Js Expert by building an Instagram Like Web App with React 16, React Router, Redux & Firebase!",₹556,"₹12,160",Development,Web Development,React
